[
  {
    "artist_id": "CRT_NEL_BLU_DIPINTO_DI_BLU_VOLARE_0000",
    "full_legal_name": "Nel Blu Dipinto Di Blu (Volare)",
    "stage_name": "Nel Blu Dipinto Di Blu (Volare)",
    "primary_musical_genre": "Pop / Vocal",
    "birth_or_formation_date": "1935-05-15",
    "country_of_citizenship": "Canada",
    "active_career_start_year": 1950,
    "is_group_ensemble_flag": false,
    "musicbrainz_artist_gid": "753d9f22c45c3895db0c4fd621c12eb9",
    "official_website_url": "https://www.musicbrainz.org/artist/NEL_BLU_DIPINTO_DI_BLU_VOLARE",
    "biography_overview": "Celebrated recording artist and Grammy-honored musician Nel Blu Dipinto Di Blu (Volare)."
  },
  {
    "artist_id": "CRT_HENRY_MANCINI_0001",
    "full_legal_name": "Henry Mancini",
    "stage_name": "Henry Mancini",
    "primary_musical_genre": "Rock",
    "birth_or_formation_date": "1936-05-15",
    "country_of_citizenship": "United States",
    "active_career_start_year": 1951,
    "is_group_ensemble_flag": false,
    "musicbrainz_artist_gid": "91d037a256f8fcca352e7ba015ed7dde",
    "official_website_url": "https://www.musicbrainz.org/artist/HENRY_MANCINI",
    "biography_overview": "Celebrated recording artist and Grammy-honored musician Henry Mancini."
  },
  {
    "artist_id": "CRT_ELLA_FITZGERALD_0002",
    "full_legal_name": "Ella Fitzgerald",
    "stage_name": "Ella Fitzgerald",
    "primary_musical_genre": "R&B / Soul",
    "birth_or_formation_date": "1937-05-15",
    "country_of_citizenship": "United States",
    "active_career_start_year": 1952,
    "is_group_ensemble_flag": false,
    "musicbrainz_artist_gid": "4b22e0d3176e12b91a35056f373ea39f",
    "official_website_url": "https://www.musicbrainz.org/artist/ELLA_FITZGERALD",
    "biography_overview": "Celebrated recording artist and Grammy-honored musician Ella Fitzgerald."
  },
  {
    "artist_id": "CRT_CATCH_A_FALLING_STAR_0003",
    "full_legal_name": "Catch A Falling Star",
    "stage_name": "Catch A Falling Star",
    "primary_musical_genre": "Jazz",
    "birth_or_formation_date": "1938-05-15",
    "country_of_citizenship": "United States",
    "active_career_start_year": 1953,
    "is_group_ensemble_flag": false,
    "musicbrainz_artist_gid": "510ac857ec6d45766bfe986a334f0ba4",
    "official_website_url": "https://www.musicbrainz.org/artist/CATCH_A_FALLING_STAR",
    "biography_overview": "Celebrated recording artist and Grammy-honored musician Catch A Falling Star."
  },
  {
    "artist_id": "CRT_BILLY_MAY_S_BIG_FAT_BRASS_0004",
    "full_legal_name": "Billy May's Big Fat Brass",
    "stage_name": "Billy May's Big Fat Brass",
    "primary_musical_genre": "Pop / Vocal",
    "birth_or_formation_date": "1939-05-15",
    "country_of_citizenship": "United States",
    "active_career_start_year": 1954,
    "is_group_ensemble_flag": false,
    "musicbrainz_artist_gid": "ad1d46c2b00c93cd1708ea36d42613a9",
    "official_website_url": "https://www.musicbrainz.org/artist/BILLY_MAY_S_BIG_FAT_BRASS",
    "biography_overview": "Celebrated recording artist and Grammy-honored musician Billy May's Big Fat Brass."
  },
  {
    "artist_id": "CRT_BASIE_0005",
    "full_legal_name": "Basie",
    "stage_name": "Basie",
    "primary_musical_genre": "Rock",
    "birth_or_formation_date": "1940-05-15",
    "country_of_citizenship": "Canada",
    "active_career_start_year": 1955,
    "is_group_ensemble_flag": false,
    "musicbrainz_artist_gid": "3260b152d1d29f3eab9d32e04bbfbeb1",
    "official_website_url": "https://www.musicbrainz.org/artist/BASIE",
    "biography_overview": "Celebrated recording artist and Grammy-honored musician Basie."
  },
  {
    "artist_id": "CRT_THAT_OLD_BLACK_MAGIC_0006",
    "full_legal_name": "That Old Black Magic",
    "stage_name": "That Old Black Magic",
    "primary_musical_genre": "R&B / Soul",
    "birth_or_formation_date": "1941-05-15",
    "country_of_citizenship": "United States",
    "active_career_start_year": 1956,
    "is_group_ensemble_flag": false,
    "musicbrainz_artist_gid": "a12ff64595f28e36534118ea31cc5f6c",
    "official_website_url": "https://www.musicbrainz.org/artist/THAT_OLD_BLACK_MAGIC",
    "biography_overview": "Celebrated recording artist and Grammy-honored musician That Old Black Magic."
  },
  {
    "artist_id": "CRT_THE_CHIPMUNK_SONG_0007",
    "full_legal_name": "The Chipmunk Song",
    "stage_name": "The Chipmunk Song",
    "primary_musical_genre": "Jazz",
    "birth_or_formation_date": "1942-05-15",
    "country_of_citizenship": "United States",
    "active_career_start_year": 1957,
    "is_group_ensemble_flag": true,
    "musicbrainz_artist_gid": "0fcd36d3063741cc4e16a02efca4d52b",
    "official_website_url": "https://www.musicbrainz.org/artist/THE_CHIPMUNK_SONG",
    "biography_overview": "Celebrated recording artist and Grammy-honored musician The Chipmunk Song."
  },
  {
    "artist_id": "CRT_TOM_DOOLEY_0008",
    "full_legal_name": "Tom Dooley",
    "stage_name": "Tom Dooley",
    "primary_musical_genre": "Pop / Vocal",
    "birth_or_formation_date": "1943-05-15",
    "country_of_citizenship": "United States",
    "active_career_start_year": 1958,
    "is_group_ensemble_flag": false,
    "musicbrainz_artist_gid": "5f17e1a1d993057907a77f3f8a0ccbb4",
    "official_website_url": "https://www.musicbrainz.org/artist/TOM_DOOLEY",
    "biography_overview": "Celebrated recording artist and Grammy-honored musician Tom Dooley."
  },
  {
    "artist_id": "CRT_TEQUILA_0009",
    "full_legal_name": "Tequila",
    "stage_name": "Tequila",
    "primary_musical_genre": "Rock",
    "birth_or_formation_date": "1944-05-15",
    "country_of_citizenship": "United States",
    "active_career_start_year": 1959,
    "is_group_ensemble_flag": false,
    "musicbrainz_artist_gid": "2505f2b3f5d789478b6edf49af6a07f7",
    "official_website_url": "https://www.musicbrainz.org/artist/TEQUILA",
    "biography_overview": "Celebrated recording artist and Grammy-honored musician Tequila."
  },
  {
    "artist_id": "CRT_DUETS_WITH_A_SPANISH_GUITAR_0010",
    "full_legal_name": "Duets With A Spanish Guitar",
    "stage_name": "Duets With A Spanish Guitar",
    "primary_musical_genre": "R&B / Soul",
    "birth_or_formation_date": "1945-05-15",
    "country_of_citizenship": "Canada",
    "active_career_start_year": 1960,
    "is_group_ensemble_flag": false,
    "musicbrainz_artist_gid": "1af60d08cf1544a94e865ff64971edac",
    "official_website_url": "https://www.musicbrainz.org/artist/DUETS_WITH_A_SPANISH_GUITAR",
    "biography_overview": "Celebrated recording artist and Grammy-honored musician Duets With A Spanish Guitar."
  },
  {
    "artist_id": "CRT_FRANK_SINATRA_0011",
    "full_legal_name": "Frank Sinatra",
    "stage_name": "Frank Sinatra",
    "primary_musical_genre": "Jazz",
    "birth_or_formation_date": "1946-05-15",
    "country_of_citizenship": "United States",
    "active_career_start_year": 1961,
    "is_group_ensemble_flag": false,
    "musicbrainz_artist_gid": "c2923e62d7e08016c86bfb65a7d0a2a4",
    "official_website_url": "https://www.musicbrainz.org/artist/FRANK_SINATRA",
    "biography_overview": "Celebrated recording artist and Grammy-honored musician Frank Sinatra."
  },
  {
    "artist_id": "CRT_CROSS_COUNTRY_SUITE_0012",
    "full_legal_name": "Cross Country Suite",
    "stage_name": "Cross Country Suite",
    "primary_musical_genre": "Pop / Vocal",
    "birth_or_formation_date": "1947-05-15",
    "country_of_citizenship": "United States",
    "active_career_start_year": 1962,
    "is_group_ensemble_flag": false,
    "musicbrainz_artist_gid": "a40fcc705aa6662dd1fa138dc7c99d06",
    "official_website_url": "https://www.musicbrainz.org/artist/CROSS_COUNTRY_SUITE",
    "biography_overview": "Celebrated recording artist and Grammy-honored musician Cross Country Suite."
  },
  {
    "artist_id": "CRT_THE_MUSIC_MAN_0013",
    "full_legal_name": "The Music Man",
    "stage_name": "The Music Man",
    "primary_musical_genre": "Rock",
    "birth_or_formation_date": "1948-05-15",
    "country_of_citizenship": "United States",
    "active_career_start_year": 1963,
    "is_group_ensemble_flag": true,
    "musicbrainz_artist_gid": "a5fda45c90e976215e505ee3c8de9653",
    "official_website_url": "https://www.musicbrainz.org/artist/THE_MUSIC_MAN",
    "biography_overview": "Celebrated recording artist and Grammy-honored musician The Music Man."
  },
  {
    "artist_id": "CRT_ANDR_PREVIN_0014",
    "full_legal_name": "Andr\u00e9 Previn",
    "stage_name": "Andr\u00e9 Previn",
    "primary_musical_genre": "R&B / Soul",
    "birth_or_formation_date": "1949-05-15",
    "country_of_citizenship": "United States",
    "active_career_start_year": 1964,
    "is_group_ensemble_flag": false,
    "musicbrainz_artist_gid": "9187e0c6e6d169df58fdd0d479716de4",
    "official_website_url": "https://www.musicbrainz.org/artist/ANDR_PREVIN",
    "biography_overview": "Celebrated recording artist and Grammy-honored musician Andr\u00e9 Previn."
  },
  {
    "artist_id": "CRT_THE_BEST_OF_THE_STAN_FREBERG_S_0015",
    "full_legal_name": "The Best Of The Stan Freberg Shows",
    "stage_name": "The Best Of The Stan Freberg Shows",
    "primary_musical_genre": "Jazz",
    "birth_or_formation_date": "1950-05-15",
    "country_of_citizenship": "Canada",
    "active_career_start_year": 1965,
    "is_group_ensemble_flag": true,
    "musicbrainz_artist_gid": "e2b130708533fea608acfce88f3a5a30",
    "official_website_url": "https://www.musicbrainz.org/artist/THE_BEST_OF_THE_STAN_FREBERG_S",
    "biography_overview": "Celebrated recording artist and Grammy-honored musician The Best Of The Stan Freberg Shows."
  },
  {
    "artist_id": "CRT_GAIETE_PARISIENNE_0016",
    "full_legal_name": "Gaiete Parisienne",
    "stage_name": "Gaiete Parisienne",
    "primary_musical_genre": "Pop / Vocal",
    "birth_or_formation_date": "1951-05-15",
    "country_of_citizenship": "United States",
    "active_career_start_year": 1966,
    "is_group_ensemble_flag": false,